{
  "format": "owd-managed-rate-limit-registry-v1",
  "schemaVersion": 1,
  "accountId": "00000000000000000000000000000000",
  "updatedAt": "2026-08-06T00:00:00.000Z",
  "reservations": [
    {
      "cellRef": "synthetic-cell-01",
      "workerName": "owd-cell-synthetic01",
      "manifestSha256": "8d9f20d7bedb4e9bc894607c76eb9a84eac01a5253c3e25b62465e9aae4db156",
      "namespaceIds": ["710001", "710002", "710003", "710004", "710005"],
      "status": "reserved"
    }
  ]
}
